{
  "coverage_version": "playable-coverage-v5",
  "part_catalog_version": "ticket-parts-v2",
  "ticket_content_version": "core-ticket-parts-v4",
  "domain_content_version": "core-domain-snapshot-story-expansion-v4",
  "card_catalog_version": "core-card-catalog-story-expansion-v5",
  "source_manifest_files": [
    "./core-v0.1-case-study-gaps.json",
    "./core-v0.1-components.json",
    "./core-v0.1-diagnostics.json",
    "./core-v0.1-fault-graph.json",
    "./core-v0.1-faults.json",
    "./core-v0.1-post-market-bench.json",
    "./core-v0.1-protocols.json",
    "./core-v0.1-repairs-validations.json",
    "./core-v0.1-symptoms.json"
  ],
  "inventory": {
    "knowledge_records": 257,
    "action_bearing_records": 107,
    "tests": 37,
    "commands": 13,
    "repairs": 35,
    "validations": 22,
    "promoted_diagnostics": 50,
    "selected_repairs": 18,
    "selected_validations": 15,
    "playable_card_definitions": 83,
    "supported_fingerprints": 18,
    "records_by_entity_type": {
      "command": 13,
      "component": 25,
      "fault": 42,
      "fault_causal_edge": 17,
      "protocol": 20,
      "repair_procedure": 35,
      "symptom": 33,
      "test": 37,
      "tool": 13,
      "validation_procedure": 22
    }
  },
  "selected_action_definition_ids": [
    "command.ipmi.sel_elist",
    "command.linux.dhclient",
    "command.linux.dmesg",
    "command.linux.ethtool",
    "command.linux.free_h",
    "command.linux.ip_addr",
    "command.linux.ip_route",
    "command.linux.journalctl",
    "command.linux.lsblk",
    "command.linux.lspci",
    "command.linux.nvme_smart_log",
    "command.linux.smartctl",
    "command.network.ping",
    "repair.boot.correct_order",
    "repair.compute.restore_socket_contacts",
    "repair.firmware.restore_compatible_versions",
    "repair.management.clear_stale_alert_state",
    "repair.management.recover_bmc_firmware",
    "repair.memory.replace_dimm",
    "repair.memory.reseat_dimm",
    "repair.network.correct_static_ip",
    "repair.network.replace_cable",
    "repair.power.replace_distribution_board",
    "repair.power.replace_psu",
    "repair.power.reseat_psu",
    "repair.storage.replace_nvme",
    "repair.storage.replace_predictive_drive",
    "repair.storage.replace_raid_member",
    "repair.storage.reseat_cable",
    "repair.thermal.clean_cooling_path",
    "repair.thermal.replace_fan",
    "test.boot.device_inventory",
    "test.boot.post_code_analysis",
    "test.boot.post_observation",
    "test.compute.socket_magnified_inspection",
    "test.cooling.location_cross_substitution",
    "test.electrical.continuity",
    "test.firmware.settings_review",
    "test.firmware.version_compatibility",
    "test.general.minimum_configuration",
    "test.general.visual_inspection",
    "test.management.bmc_recovery_state",
    "test.management.event_log_freshness",
    "test.memory.diagnostic",
    "test.memory.known_good_substitution",
    "test.memory.single_dimm_isolation",
    "test.network.cable_substitution",
    "test.network.dhcp_pool_audit",
    "test.network.dhcp_transaction_trace",
    "test.network.interface_config",
    "test.network.link",
    "test.network.link_counter_soak",
    "test.network.ping",
    "test.pcie.inventory",
    "test.power.distribution_path_isolation",
    "test.power.known_good_psu",
    "test.power.output_voltage_measurement",
    "test.power.psu_status",
    "test.power.residual_power_drain",
    "test.storage.bay_path_isolation",
    "test.storage.device_inventory",
    "test.storage.drive_health",
    "test.storage.predictive_health",
    "test.storage.raid_status",
    "test.system.bmc_logs",
    "test.system.controlled_stress",
    "test.thermal.fan_telemetry",
    "test.thermal.temperature_monitoring",
    "verify.boot.normal_boot",
    "verify.compute.socket_path",
    "verify.firmware.compatible_persistent",
    "verify.management.alert_does_not_recur",
    "verify.management.bmc_functional",
    "verify.memory.full_test",
    "verify.memory.inventory",
    "verify.network.connectivity",
    "verify.network.link",
    "verify.power.distribution_path",
    "verify.power.stable",
    "verify.storage.device_detected",
    "verify.storage.predictive_replacement",
    "verify.storage.raid_healthy",
    "verify.thermal.load_test"
  ],
  "deferred_action_definition_ids": [
    "repair.board.replace_rtc_battery",
    "repair.board.replace_system_board",
    "repair.boot.repair_bootloader",
    "repair.cooling.repair_fan_connector",
    "repair.firmware.restore_settings",
    "repair.memory.correct_population",
    "repair.network.clear_stale_dhcp_reservations",
    "repair.network.reconnect_cable",
    "repair.network.replace_nic",
    "repair.pcie.reseat_card",
    "repair.power.reconnect_input",
    "repair.storage.backup_rebuild_restore",
    "repair.storage.rebuild_array",
    "repair.storage.replace_backplane",
    "repair.storage.replace_cable",
    "repair.storage.replace_raid_controller",
    "repair.thermal.restore_heatsink_contact",
    "verify.boot.post",
    "verify.cooling.fan_sense_path",
    "verify.firmware.settings_persist",
    "verify.network.dhcp_lease",
    "verify.pcie.device_present",
    "verify.storage.backplane_path",
    "verify.system.burn_in"
  ],
  "diagnostic_definition_ids": [
    "card.bench.command.ipmi.sel_elist",
    "card.bench.command.linux.dhclient",
    "card.bench.command.linux.dmesg",
    "card.bench.command.linux.ethtool",
    "card.bench.command.linux.free_h",
    "card.bench.command.linux.ip_addr",
    "card.bench.command.linux.ip_route",
    "card.bench.command.linux.journalctl",
    "card.bench.command.linux.lsblk",
    "card.bench.command.linux.lspci",
    "card.bench.command.linux.nvme_smart_log",
    "card.bench.command.linux.smartctl",
    "card.bench.command.network.ping",
    "card.bench.test.boot.device_inventory",
    "card.bench.test.boot.post_code_analysis",
    "card.bench.test.boot.post_observation",
    "card.bench.test.compute.socket_magnified_inspection",
    "card.bench.test.cooling.location_cross_substitution",
    "card.bench.test.electrical.continuity",
    "card.bench.test.firmware.settings_review",
    "card.bench.test.firmware.version_compatibility",
    "card.bench.test.general.minimum_configuration",
    "card.bench.test.general.visual_inspection",
    "card.bench.test.management.bmc_recovery_state",
    "card.bench.test.management.event_log_freshness",
    "card.bench.test.memory.diagnostic",
    "card.bench.test.memory.known_good_substitution",
    "card.bench.test.memory.single_dimm_isolation",
    "card.bench.test.network.cable_substitution",
    "card.bench.test.network.dhcp_pool_audit",
    "card.bench.test.network.dhcp_transaction_trace",
    "card.bench.test.network.interface_config",
    "card.bench.test.network.link",
    "card.bench.test.network.link_counter_soak",
    "card.bench.test.network.ping",
    "card.bench.test.pcie.inventory",
    "card.bench.test.power.distribution_path_isolation",
    "card.bench.test.power.known_good_psu",
    "card.bench.test.power.output_voltage_measurement",
    "card.bench.test.power.psu_status",
    "card.bench.test.power.residual_power_drain",
    "card.bench.test.storage.bay_path_isolation",
    "card.bench.test.storage.device_inventory",
    "card.bench.test.storage.drive_health",
    "card.bench.test.storage.predictive_health",
    "card.bench.test.storage.raid_status",
    "card.bench.test.system.bmc_logs",
    "card.bench.test.system.controlled_stress",
    "card.bench.test.thermal.fan_telemetry",
    "card.bench.test.thermal.temperature_monitoring"
  ],
  "outcome_families": [
    {
      "part_id": "outcome_family.clean.v1",
      "classification": "CLEAN",
      "public_summary": "The diagnostic completed cleanly and produced no candidate-changing finding in this machine state."
    },
    {
      "part_id": "outcome_family.unrelated.v1",
      "classification": "IRRELEVANT",
      "public_summary": "The diagnostic completed but produced no finding relevant to this Ticket."
    },
    {
      "part_id": "outcome_family.inconclusive.v1",
      "classification": "INCONCLUSIVE",
      "public_summary": "The diagnostic completed, but the observation is inconclusive for the current candidates."
    }
  ],
  "fingerprints": [
    {
      "fingerprint_id": "fingerprint.storage.loose_cable",
      "subsystem": "storage",
      "part_ids": [
        "truth.storage.loose_cable.v1",
        "context.storage.io_errors.v1",
        "candidate_pool.public_relationships.v1",
        "diagnostics.storage.loose_cable.v1",
        "isolation.storage.loose_cable.v1",
        "repair_plan.storage.loose_cable.v1",
        "verify_plan.storage.detected.v1",
        "teaching.storage.v1",
        "closure.complete_path.v1"
      ],
      "symptom_ids": [
        "symptom.storage.io_errors"
      ],
      "public_candidate_fault_ids": [
        "fault.storage.backplane.path_failed",
        "fault.storage.cable.failed",
        "fault.storage.cable.loose",
        "fault.storage.nvme.device_failed",
        "fault.storage.sas.drive_failed"
      ],
      "actionable_fault_ids": [
        "fault.storage.cable.loose"
      ],
      "causal_edge_ids": [],
      "machine_state_keys": [
        "machine.storage.loose_cable.active",
        "machine.storage.loose_cable.active.repaired"
      ],
      "diagnostic_source_ids": [
        "test.general.visual_inspection",
        "test.storage.device_inventory"
      ],
      "isolation_route_kinds": [
        "CORROBORATED_SUPPORT"
      ],
      "repair_procedure_ids": [
        "repair.storage.reseat_cable"
      ],
      "validation_procedure_ids": [
        "verify.storage.device_detected"
      ],
      "required_response_card_definition_ids": [
        "card.response.repair.storage.reseat_cable",
        "card.response.verify.storage.device_detected"
      ],
      "closure": "accepted Isolation + cited decisive Evidence + necessary Repair + all current passing Verifies"
    },